{
  "schema_version": "asw.evaluation_scenario.v1",
  "scenario_id": "artifact-ready",
  "class": "file_artifact_transition",
  "primary": true,
  "application_id": "app.eval-file",
  "transition_kinds": [
    "artifact.available"
  ],
  "ground_truth_fields": [
    "transition_ns",
    "application_id",
    "transition_kind"
  ],
  "applicable_baselines": [
    "polling",
    "filesystem_watch",
    "ordinary_notification",
    "repeated_observation",
    "asw"
  ]
}
